13159;2;"Comando da 7ª Região Militar e 7ª Divisão de Exército";"09598288000112";FALSE;
13160;6;"DIGITAL LINK INFORMATICA LTDA";"08832774000190";FALSE;
13166;6;"PROTWORK MATERIAIS CIRURGICOS LTDA - EPP";"02911166000195";FALSE;
13167;6;"FACILITA SERVICOS E COMERCIO DE PRODUTOS";"13004212000199";FALSE;
13168;6;"PLANET GRAF COMERCIO E IMPRESSAO DE PAPEL";"02176635000170";FALSE;
13169;6;"SHAPER DO BRASIL COMERCIO E SERVICOS LTDA";"07692391000100";FALSE;
13170;6;"BAZAR DACAPE LTDA - ME";"08628974000126";FALSE;
13171;6;"AJURDY DISTRIBUIDORA DE PRODUTOS LTDA - M";"09102265000175";FALSE;
13172;6;"MRP Auditoria e Consultoria S/S";"13505864000107";FALSE;
13173;6;"ACN INOVACOES COMERCIO DE MATERIAL E SERV";"12387751000191";FALSE;
13175;6;"Eurobravin Comércio e Serviços Ltda";"05462641000181";FALSE;
13182;6;"MANSUR INDÚSTRIA E COMÉRCIO LTDA EPP";"11026389000160";FALSE;
13184;6;"SUECIA VEICULOS S.A.";"02714977000449";FALSE;
13189;6;"MICROSTAR INFORMATICA - EIRELI - ME";"05406239000180";FALSE;
13191;6;"AMAZING OFFICE COMERCIO E SERVICOS DE INF";"13966902000129";FALSE;
13192;6;"S C M ACANTO COMERCIO DE MATERIAL DE LIMP";"14838926000165";FALSE;
13193;6;"REAL CENTER MATERIAIS DE CONSTRUCAO LTDA";"15658667000153";FALSE;
13194;6;"MULTIART DISTRIBUIDORA DE MATERIAIS E SER";"16964434000141";FALSE;
13195;6;"HUGO LUIZ DE OLIVEIRA 05544430900";"17161916000126";FALSE;
13196;6;"MUTARE DISTRIBUIDORA E PRESTADORA DE SERV";"17308611000102";FALSE;
13197;6;"MARIA RAMOS DE MELO - ME";"17363687000122";FALSE;
13198;6;"MADEIRAS E FERRAGENS LIMITES LTDA - EPP";"42312280000113";FALSE;
23201;6;"LH GONÇALVES COMPONENTES ELETRÔNICOS - EPP";"08288901000132";FALSE;
23202;6;"HAYMAX DISTRIBUIDORA DE PRODUTOS ELETRÔNICO LTDA";"01725627000253";FALSE;
23204;6;"Microsens  Ltda";"78126950000316";FALSE;
23206;6;"D BRIZIO COMERCIO DE PECAS E SERVICOS AUT";"11911729000136";FALSE;
23207;2;"13ª BRIGADA DE INFANTARIA MOTORIZADA";"09644194000132";FALSE;
23208;6;"Capital TEcnologia e Equipamentos Ltda";"03573081000107";FALSE;
23209;6;"M. Farias Martins";"12675365000103";FALSE;
23212;6;"Liggo Informática e Conectividade Ltda - ME";"07607407000120";FALSE;
23213;6;"COMDADOS COMÉRCIO E SERVIÇOS";"34203752000171";FALSE;
23215;6;"AMDA SECURITY IMPORTADORA LTDA - ME";"14793395000131";FALSE;
23217;6;"MEDEIROS & CARVALHO LTDA - ME";"07225940000128";FALSE;
23220;2;"5ª COMPANHIA DE COMUNICAÇÕES BLINDADA";"09636761000109";FALSE;
23221;6;"JOÃO VERGÍLIO MRUZ - ME";"77960730000169";FALSE;
23222;6;"ALTA COMERCIAL LTDA - ME";"05076619000101";FALSE;
23225;6;"Nelton Rubens Eduardo - ME";"07705081000174";FALSE;
23229;6;"LPG SOLUÇÕES LTDA EPP";"03454049000102";FALSE;
23230;6;"COPY INFO - COMÉRCIO DE MAQUINAS E SUPRIMENTOS";"07940946000187";FALSE;
23231;6;"dhiego caetano pagoto ltda";"18134972000134";FALSE;
23234;2;"2º REGIMENTO DE CAVALARIA DE GUARDA - REGIMENTO ANDRADE NEVES";"09585272000175";FALSE;
23235;6;"Mactecnology Comercio de Informática Ltda";"10345104000191";FALSE;
23236;3;"COMPANHIA ESTADUAL DE ÁGUAE E ESGOTOS - CEDAE";"33352394000104";FALSE;
23237;3;"LIGHT SERVIÇOS DE ELETRICIDADE S A";"60444437000146";FALSE;
23238;6;"REDE NACIONAL DE ENSINO E PESQUISA - RNP";"03508097000136";FALSE;
23239;6;"BEZERRA E LIMA MATERIAIS E SERVICOS DE CONSTRUÇÃO LTDA -ME";"02543373000134";FALSE;
23240;2;"13° Batalhão de Infantaria Blindado";"09564970000194";FALSE;
23241;6;"Armazém Avenida LTDA- EPP";"11513751000128";FALSE;
23242;6;"MICROTECNICA INFORMATICA LTDA";"01590728000264";FALSE;
23243;2;"3º Regimento de Carros  de Carros de Combate";"11358294000144";FALSE;
23244;2;"14 Regimento de Cavalaria Mecanizado";"09543440000160";FALSE;
23245;2;"COMANDO DA 1ª REGIÃO MILITAR";"10189168000140";FALSE;
23246;6;"REFRIGERAÇÃO COLD DE LUCAS LTDA ME";"32380131000138";FALSE;
23247;6;"PROTECO INDUSTRIA ELETROTECNICA LTDA";"61310801000148";FALSE;
23249;6;"Ethos Comercial e Servicos Ltda - ME";"10745622000100";FALSE;
23250;2;"COMANDO DO COMANDO MILITAR DO LESTE";"10014999000181";FALSE;
23251;6;"AJA INFORMÁTICA LTDA";"15565106000100";FALSE;
23253;6;"Audio Visão Eletroacústica LTDA - ME";"00489661000122";FALSE;
23254;6;"BARRETO E COMÉRCIO E SERVIÇOS LTDA - EPP";"04246291000153";FALSE;
23255;6;"POINTER ABC, COMERCIO, IMPORTAÇÃO e EXPORTAÇÃO";"01030894000125";FALSE;
23256;6;"VIASAT INFORMÁTICA IMPORTAÇÃO E EXPORTAÇÃO LTDA";"10791505000175";FALSE;
23257;6;"ELETRA TECNOLOGIA E INFORMÁTICA LTDA";"01804159000121";FALSE;
23258;6;"SOPHO BUSINES COMMUNICATIONS SOLUÇÕES EMPRESARIAIS";"04078456000125";FALSE;
23259;6;"SCHNEIDER ELETRIC BRASIL IND E COM";"07108509000100";FALSE;
23260;6;"INTEGRA BR COMERCIO DISTRIBUIÇÃO E SERVIÇOS DE INFORMATICA";"17713145000132";FALSE;
23261;6;"GLOBAL POWER IMP EXP";"08363515000168";FALSE;
23262;6;"JANETE PINTO";"10812554000147";FALSE;
23263;6;"MOBILIDADE TECNOLOGICA";"16709090000124";FALSE;
23264;6;"CONDUFIBRA DISTRIBUIDORA DE CABOS";"05999532000106";FALSE;
23266;6;"zip tec informática";"08923710000103";FALSE;
23267;6;"CLIK DATA SOLUÇÕES LTDA";"12431149000104";FALSE;
23269;6;"JVS COMÉRCIO E SERVIÇOS DE INFORMÁTICA";"10190265000153";FALSE;
23272;6;"Consórcio EPT-SERENGE-SERKI";;TRUE;
23273;6;"elf informática ltda - me";"06156607000141";FALSE;
23274;6;"laitano";"17023484000197";FALSE;
23275;6;"DAMASO COMÉRCIO E SERVIÇOS LTDA - ME";"10278886000193";FALSE;
23278;6;"SUL TECH TELE INFORMÁTICA LTDA";"08432172000146";FALSE;
23280;6;"IMPERHOUSE ITAJUBA IMPERMEABILIZACAO E COMERCIO LTDA";"03598394000110";FALSE;
23282;6;"GGS - INCORPORADORA E CONSTRUCOES LTDA - ME";"12257852000148";FALSE;
23285;6;"SUPORTE 3 PLANEJAMENTO E CONSTRUCOES LTDA - ME";"05258977000127";FALSE;
23286;6;"REDE A REDE TELECOMUNICAÇÕES LTDA";"03958771000184";FALSE;
23287;6;"GLOBAL VILLAGE TELECOM LTDA";"03420926000124";FALSE;
23288;2;"13º Grupo de Artilharia de Campanha";"09563296000123";FALSE;
23289;6;"Volmir da Costa Flores - ME";"12661767000140";FALSE;
23290;2;"HARD SOLUTION INFORMÁTICA LTDA - ME";"00461255000151";FALSE;
23291;6;"ROBOX GERADORES LTDA - ME";"04946668000187";FALSE;
23292;6;"HANNA E ROSE SERVIÇO E COMÉRCIO LTDA - EPP";"01355919000160";FALSE;
23293;6;"Distribuidora de Alimentos Katzer LTDA";"00933855000175";FALSE;
23294;6;"MB CALEDÔNIA GÊNEROS ALIMENTÍCIOS LTDA - EPP";"07042664000162";FALSE;
23295;6;"CANTO DA LUA COMÉRCIO E SERVIÇOS LTDA - ME";"10553214000149";FALSE;
23296;6;"VIDEOMÁTICA ELETRÔNICA E INFORMÁTICA LTDA";"29710118000195";FALSE;
23297;6;"LED WORK COMÉRCIO E SERVIÇOS LTDA - ME";"11197714000158";FALSE;
23298;4;"INCOSEG - INDUSTRIA E COMERCIO DE EQUIPAMENTOS";"06973196000187";FALSE;
23299;6;"MAVE DISTRIBUIDORA DE PRODUTOS ALIMENTÍCIOS LTDA";"14426255000125";FALSE;
23300;6;"PWS TECNOLOGIA LTDA - EPP";"12124627000133";FALSE;
23301;6;"EMPLOY COMÉRCIO E SERVIÇOS LTDA";"10974412000186";FALSE;
23302;6;"TECNO SEG INFORMÁTICA E SEGURANÇA DE DADOS LTDA";"13345633000183";FALSE;
23303;6;"DIGITEL S.A. INDUSTRIA ELETRÔNICA";"89547269000104";FALSE;
23304;6;"SINCROTEL TELECOMUNICAÇÕES LTDA - ME";"01135065000107";FALSE;
23305;6;"A. O. S. COMÉRCIO E SERVIÇO LTDA";"07088332000119";FALSE;
23306;6;"IRMÃOS SOUSA COMÉRCIO SERVIÇO E REPRESENTAÇÕES LTDA";"00389646000102";FALSE;
23307;2;"Vigésimo Batalhão de Infantaria Blindado";"09662517000110";FALSE;
23308;6;"C & A CONSTRUÇÃO LTDA - ME";"01444316000135";FALSE;
23309;6;"DILCREIA MARTINS FAGUNDES DO NASCIMENTO - ME";"09450715000110";FALSE;
23310;6;"CCR CURSOS LTDA - ME";"07211072000127";FALSE;
23311;6;"VITRINE AMBIENTES PARA ESCRITÓRIO LTDA";"05684135000137";FALSE;
23312;6;"ROMULO NONATO DA SILVA JUNIOR - EPP";"11377888000100";FALSE;
23313;6;"JOSE GERALDO DAINESI - EPP";"05233608000180";FALSE;
23314;6;"PROTON COMERCIO E DISTRIBUIÇÃO DE ELETRO-ELETRONICO";"16887672000109";FALSE;
23315;6;"CELIA TERESINHA GRACIOLI - EPP";"08870555000104";FALSE;
23316;6;"MAZZO INFORMATICA E ELETROELETRONICOS LTDA";"06303577000159";FALSE;
23317;2;"Fluke do Brasil LTDA";"02370758000147";FALSE;
23318;2;"Ministério das Comunicações";"00394437000319";FALSE;
23319;6;"Patrícia Dezordi - Informática - ME";"11901991000108";FALSE;
23320;6;"IMPERIAL SUPRIMENTOS DE INFORMATICA LTDA";"09163698000130";FALSE;
23321;6;"Lexbemark Comércio Ltda - EPP";"03328413000198";FALSE;
23322;6;"Papelaria Office Box Ltda - ME";"12210110000167";FALSE;
23323;6;"MECANICA BATISTA LTDA";"09016479000129";FALSE;
23324;6;"RV Comércio de Papéis Ltda";"71251029000194";FALSE;
23325;6;"OSX Comércio Ltda - ME";"16639211000109";FALSE;
23326;2;"5º GRUPO DE ARTILHARIA DE CAMPANHA AUTOPROPULSADO";"09589084000115";FALSE;
23327;6;"P. C. de Oliveira Filho Suprimentos";"13295560000162";FALSE;
23328;6;"DURO PVC LTDA";"00426978000110";FALSE;
23329;6;"Mabone Comercial Ltda - EPP";"12564391000156";FALSE;
23330;6;"BRAFER CONSTRUÇÕES METÁLICAS S.A.";"77153773000132";FALSE;
23331;6;"SENCONSULT";"40888380000167";FALSE;
23332;6;"CINTE INDÚSTRIA E COMÉRCIO E SERVIÇOS LTDA-EPP";"08378641000196";FALSE;
23334;6;"Consorcio Procon-CC-TB";;TRUE;
23335;2;"BASE NAVAL DE NATAL";"00394502003321";FALSE;
23336;6;"MGF - COMÉRCIO E SERVIÇOS LTDA - EPP";"01892448000120";FALSE;
23337;6;"DJ MATERIAL DE CONSTRUÇÃO LTDA - ME";"06267047000100";FALSE;
23338;6;"DEISE CARDOSO GONDIM CARVALHO - ME";"13752496000100";FALSE;
23341;6;"RENASCER MERCANTIL FERRAGISTA LTDA";"07264693000179";FALSE;
23345;2;"5º BATALHÃO LOGÍSTICO";"09647168000168";FALSE;
23346;6;"CAMPOS MAIA MATERIAIS DE CONSTRUÇÃO LTDA - ME";"04869356000117";FALSE;
23347;6;"PETRODIESEL COMERCIAL LTDA";"57910432000157";FALSE;
23348;6;"Real Refor Engenharia Ltda - EPP";"06071065000104";FALSE;
23349;6;"SOLAR - COMERCIO E SERVIÇO DE AR CONDICIONADO";"13191388000105";FALSE;
23350;6;"EFES COMERCIO E SERVIÇO DE INFORMATICALTDA";"10434081000191";FALSE;
23351;6;"A VIA TECH COMERCIO E SERVIÇOS DE ESQUIPAMENT";"03646050000139";FALSE;
23352;6;"INFORMATIC COMERCIO E REPRESENTAÇÃO LTD - E";"03596103000154";FALSE;
23353;6;"VETOR COMERCIAL E ENGENHARIA LTDA - ME";"04271612000170";FALSE;
23354;6;"NGR COMERCIO DE PAPELARIA E INFORMATICA LTDA";"08235761000134";FALSE;
23355;6;"CLINICAL MED NOVO MILÊNIO MATERIAL HOSPITALAR";"08587102000167";FALSE;
23356;6;"SGD COMERCIAL E SERVIÇOS ADMISNISTRATIVOS EIR";"17337104000199";FALSE;
23357;6;"CLENIO CARLOS SOARES - ME";"14579210000190";FALSE;
23358;6;"ACM SUPRIMENTOS E SERVIÇOS LTDA - EPP";"02531269000120";FALSE;
23359;6;"SANITARIOS ECOLOGICOS TOALETE LTDA - EPP";"04025105000156";FALSE;
23360;6;"ARGENTA TURISMO E VIAGENS LTDA - ME";"87767596000138";FALSE;
23361;6;"LEOMAR DOS SANTOS FREITAS - EPP";"00506112000119";FALSE;
23362;6;"A.B.S. - TRANSPORTES E TURISMO LTDA - EPP";"02355633000148";FALSE;
23363;6;"ANTÔNIO WILLIAN COSTA - ME";"24590259000106";FALSE;
23365;6;"EXPERT COMPUTADORES - COMÉRCIO DE EQUIPAMENTOS LTDA";"13279124000108";FALSE;
23366;2;"COMANDO DA 4ª REGIÃO MILITAR";"09576937000184";FALSE;
23367;6;"AUTO POSTO PERO LTDA";"03544105000108";FALSE;
23368;6;"EFICIENTE  ATACADISTA  LTDA";"03339994000163";FALSE;
23371;2;"27º BATALHÃO LOGÍSTICO";"10194500000165";FALSE;
23372;2;"5º REGIMENTO DE CARROS DE COMBATE";"09572476000171";FALSE;
23373;6;"POSTO ATLAS LTDA - EPP";"24739666000124";FALSE;
23375;2;"4° Batalhão de Infantaria Leve";"09621930000137";FALSE;
23376;6;"Jade AZ Comercial de Alimentos LTDA - ME";"10670182000161";FALSE;
23377;6;"SOLIVETTI COMERCIO E SERVIÇOS LTDA";"40904492000164";FALSE;
23378;6;"GUARAPUAVA CENTRO DIGITAL DE INFORMATICA LTD";"06194394000142";FALSE;
23380;6;"ROBERTO DA SILVA - ME";"17617420000114";FALSE;
23382;6;"MASTERMIX COMERCIO DE ELETROELETRONICOS LTDA - ME";"05062036000113";FALSE;
23383;6;"WILLIAN RIBEIRO SUPRIMENTOS - ME";"11696045000169";FALSE;
23384;6;"TERMOCENTER SISTEMAS TERMICOS LTDA - ME";"05192175000161";FALSE;
23388;6;"LOESCH COMERCIO DE ELETRO ELETRONICOS LTDA - ME";"14103610000125";FALSE;
23392;6;"ILUSOES INDUSTRIAIS COMERCIO DE ALIMENTOS E";"17153587000171";FALSE;
23394;6;"DAMASCENO E COELHO LTDA - ME";"13550158000187";FALSE;
23400;6;"DIGISERVI TRADING LTDA - ME";"02602747000145";FALSE;
23401;6;"joao haupt e cia ltda - epp";"76496272000196";FALSE;
23402;6;"SANTOS & MAYER COMERCIO DE EQUIPAMENTIS DE";"09457677000128";FALSE;
23403;6;"R.S.P. PERES - PRODUTOS DE LIMPEZA - ME";"10787807000170";FALSE;
23405;6;"A V INFORMATICA & CARTUCHOS LTDA - ME";"08100678000158";FALSE;
23406;6;"SANTOS & SANTOS LTDA - ME";"08583283000153";FALSE;
23409;6;"COFERMETA S.A.";"17281973000220";FALSE;
23410;6;"MEICOL SERVIÇOS DIESEL LTDA - EPP";"02181848000190";FALSE;
23411;2;"72º Batalhão de Infantaria Motorizado";"09533402000126";FALSE;
23412;6;"So pickup peças e serviços ltda - me";"13799849000119";FALSE;
23413;6;"WORLD PARTNERS SOLUÇÕES EM INFORMÁTICA LTDA - ME";"07072386000196";FALSE;
23414;6;"SYSTECH SISTEMAS E TECNOLOGIA EM INFORMÁTICA LTDA - EPP";"03263975000109";FALSE;
23416;6;"MUNDO SAT ELETRO-ELETRONICOS LTDA - EPP";"08652772000110";FALSE;
23422;6;"CPD CONSULTORIA, PALNEJAMENTO E DESENVOLVIMENTO DE SISTEMAS";"00395228000128";FALSE;
23423;6;"CMA CONSULTORIA, METODOS, ASSESSORIA E MAERCANTIL S.A.";"43819978000192";FALSE;
23424;6;"SCORPION INFORMATICA LTDA - ME";"04567265000127";FALSE;
23425;6;"TECZAP COMERCIO E DISTRIBUIÇÃO LTDA - ME";"08619872000144";FALSE;
23429;6;"FORÇA TOTAL DISTRIBUIDORA E SERVIÇOS ESPECIALIZADOS  LTDA";"15776968000181";FALSE;
23430;6;"D.T.I. COMÉRCIO DE ARTIGOS DE INFORMÁTICA LTDA - EPP";"05506073000173";FALSE;
23431;6;"NEUWALD TECNOLOGIA DA INFORMAÇÃO LTDA - ME";"09308493000104";FALSE;
23432;2;"10ª Companhia de Engenharia de Combate";"09647559000182";FALSE;
23433;2;"MULTCOMPE COMERCIO E SERVICO EM GERAL LTDA";"12805036000121";FALSE;
23434;6;"Gr comercio e serviços ltda - me";"14897423000160";FALSE;
23437;6;"LLED SOLUÇÕES TECNOLOGICAS LTDA - ME";"11885366000101";FALSE;
23439;6;"ESCRIBRASIL - COMERCIAL DE EQUIPAMENTOS EIRELI - EPP";"11983207000140";FALSE;
23440;6;"IMAGEM INFORMÁTICA LTDA - ME";"08593528000204";FALSE;
23442;2;"10ª Brigada de Infantaria Mecanizada";"09593769000135";FALSE;
23444;6;"INFORCHAVES COMERCIO DE EQUIPAMENTOS ELETRONICOS";"15615977000190";FALSE;
23445;6;"IMPORTEC INFORMATICA E SUPRIMENTOS LTDA - ME";"12710145000165";FALSE;
23447;6;"JVL INFORMATICA LTDA - ME";"17032904000100";FALSE;
23448;6;"CANEDO COMERCIO E SERVIÇOS DE INFORMÁTICA LTDA - ME";"11732040000144";FALSE;
23449;6;"ALFA 8 SOLUÇÕES EM TECNOLOGIA LTDA - ME";"10313387000190";FALSE;
23452;2;"10º Esquadrão de Cavalaria Mecanizada";"09614792000169";FALSE;
23453;6;"VIVO S.A";"02449992040891";FALSE;
23457;6;"Canal Livre Comércio e Serviços Ltda.";"05097008000131";FALSE;
23458;6;"Etel Engenharia Montagens e Automações Ltda.";"48172373000176";FALSE;
23464;6;"Consórcio C.L.E. Arena Pantanal";"18323647000110";TRUE;
23465;6;"S. & C. BANHEIROS QUIMICOS E LIMPEZA EM GERAL";"07694678000160";FALSE;
23467;6;"CYLINDER COMERCIO E SERVICOS LTDA - EPP";"02729859000161";FALSE;
23468;6;"Almeida & Silva Auto Escola LTDA- ME";"05864972000148";FALSE;
23469;6;"Niedja Lima de Santana";"08582985000112";FALSE;
23470;2;"71º BATALHÃO DE INFANTARIA MOTORIZADO";"09534290000128";FALSE;
23471;6;"DROGAMEDICA HELIOPOLIS LTDA - EPP";"70220801000148";FALSE;
23474;6;"VIMAQ MAQUINAS ARAUJO LTDA - ME";"41994831000103";FALSE;
23475;6;"MARIA ROZELIA DE SOUZA - ME";"05991236000150";FALSE;
23476;6;"DOMINGOS SAVIO ROLIM CAVALCANTI - ME";"00394209000187";FALSE;
23477;6;"INFOCENTER COM MATERIAIS DE INFORMATICA LTDA";"00132082000128";FALSE;
23478;6;"STERICYCLE GESTAO AMBIENTAL LTDA";"01568077000125";FALSE;
23479;6;"MARCIA M S G SALES CONSTRUCOES - EPP";"07595916000180";FALSE;
23481;6;"SANREG RIO COMERCIO E INDUSTRIA LTDA - ME";"07175264000125";FALSE;
23482;6;"VIRGÍNIA NUNES FALCÃO 88150828320";"16565583000138";FALSE;
23483;6;"ARV LOURENÇO COMERCIO DE PRODUTOS DE SEGURANÇA LTDA";"08771850000103";FALSE;
23486;6;"ESPAÇO DIGITAL COMERCIO E LOCAÇÃO DE AUDIO, CINE E VIDEO";"08083394000109";FALSE;
23488;6;"FLAQUITA MARITIMA COMÉRCIO DE BARCOS PEÇAS E ACESSÓRIOS";"09405420000122";FALSE;
23491;6;"AIQ FERRAMENTAS E INSTRUMENTOS LTDA - EPP";"12134879000143";FALSE;
23494;6;"DJUNIOR INDUSTRIA E COMERCIO DE VESTUARIO LTDA";"92544733000105";FALSE;
23495;6;"BIKE SUL COMERCIO DE MATERIAIS ESPORTIVOS E SERVIÇOS LTDA";"94684099000131";FALSE;
23496;2;"10ª Companhia de Engenharia de Combate";"09647559000263";FALSE;
23497;6;"AUTO PECAS ITAPOA LTDA";"65280497000194";FALSE;
23502;6;"AUTO MECANICA LANTORK LTDA";"01164373000160";FALSE;
23505;6;"SACOLAO CENTER SETELAGOANO LTDA";"66336322000114";FALSE;
23507;6;"COMPLETO COMERCIO E REPRESENTACOES LTDA - ME";"09190700000160";FALSE;
23508;6;"DISTRIBUIDORA GIRASSOL LTDA";"03847437000153";FALSE;
23509;6;"GN ALIMENTOS LTDA";"03948499000151";FALSE;
23511;6;"SANTA CLARA DISTRIBUIDORA DE PRODUTOS ALIMENTICIOS LTDA";"02744469000160";FALSE;
23515;6;"TRANSTIL TURISMO LTDA";"01583933000111";FALSE;
23516;6;"WELL RENT A CAR LTDA - EPP";"40976334000110";FALSE;
23518;6;"MOENDO COMERCIO E CONSTRUÇOES LTDA ME";"05466712000114";FALSE;
23521;6;"CIA SERTAO COMERCIO LTDA - ME";"13765842000186";FALSE;
23522;6;"B S TEIXEIRA - ME";"14997983000197";FALSE;
23524;6;"MN COMERCIO DE MATERIAIS LTDA - EPP";"08734938000147";FALSE;
23525;6;"EMPRESA BRASILEIRA DE TECNOLOGIA E ADMINISTRAÇÃO";"03506307000157";FALSE;
23527;6;"ENGEMOTORS DO BRASIL LTDA - EPP";"07892764000188";FALSE;
23529;6;"VIVIPA PRESTACAO DE SERVICOS LTDA - ME";"14918348000177";FALSE;
23530;6;"Linktel Telecomunicações do Brasil LTDA";"02945663000104";FALSE;
23531;2;"57° Batalhão de Infantaria Motorizada- REGIMENTO ESCOLA DE INFANTARIA";"09722284000102";FALSE;
23533;6;"DISBRAL DISTRIBUIDORA BRASILEIRA DE ALIMENTOS LTDA";"02956500000127";FALSE;
23534;6;"CRISTALFRIGO INDUSTRIA COMERCIO IMPORTAÇÃO E EXPORTAÇÃO";"04613751000487";FALSE;
23535;6;"CODIL ALIMENTOS LTDA";"04695085000120";FALSE;
23536;6;"MULTICOM COMERCIO MULTIPLO DE ALIMENTOS LTDA";"05656062000170";FALSE;
23537;6;"NUTRISUL LTDA - ME";"14436523000190";FALSE;
23539;6;"CAFÉ OURO NEGRO DO TRIANGULO LTDA - EPP";"16820144000124";FALSE;
23541;6;"TANGARA IMPORTADORA E EXPORTADORA S.A";"39787056000173";FALSE;
23542;6;"FRIDEL FRIGORIFICO INDUSTRIAL DEL REY LTDA";"70992359000330";FALSE;
23543;6;"DISTRIBUIDORA SEGUNDO LTDA";"86519915000123";FALSE;
23544;6;"Empresa Brasileira de Telecomunicações S.A - Embratel";"33530486000129";FALSE;
23548;6;"NCT Informática LTDA";"03017428000135";FALSE;
23550;3;"Companhia Pernambucana de Saneamento";"09769035000164";FALSE;
23553;3;"Companhia Energética de Pernambuco";"10835932000108";FALSE;
23554;2;"Empresa Brasileira de Correios e Telegrafos";"34028316002157";FALSE;
23555;6;"DP Locadora de veículos LTDA";"06007543000117";FALSE;
23556;6;"Belopetro LTDA";"00217046000167";FALSE;
23557;6;"I. BARBOSA DA SILVA - ME";"04925042000194";FALSE;
23558;6;"DIFERENCIAL COMERCIO ATACADISTA EIRELI - EPP";"09617964000158";FALSE;
23559;6;"M S CONSTRUCOES, COMERCIO E SERVICOS EIRELI EPP";"16558693000172";FALSE;
23561;6;"Consórcio VLT Cuiabá - Várzea Grande";"15753794000131";TRUE;
23562;6;"Valdemir Negromonte de Melo - EPP";"10504801000148";FALSE;
23567;6;"FCV INDUSTRIA PLATINENSE DE EXTINTORES LTDA - EPP";"03913904000104";FALSE;
23568;6;"PLAMAX EQUIPAMENTOS LTDA - EPP";"07918483000157";FALSE;
23569;6;"TOTAL - FIRE COMERCIO DE MATERIAIS DE SEGURANCA LTDA";"08467317000144";FALSE;
23570;6;"ACQUA LIFE COMERCIAL LTDA - EPP";"13950339000109";FALSE;
23571;2;"1º Batalhão de Engenharia de Construção";"07524768000103";FALSE;
23572;6;"BomBarato Locação e Turismo Ltda - ME";"35316405000118";FALSE;
23573;6;"AUTO POSTO VALE DO SAO FRANCISCO LTDA";"03939028000187";FALSE;
23574;6;"Big Car LTDA - EPP";"01016052000119";FALSE;
23575;6;"UBERPAP COMERCIO LTDA - ME";"09569733000116";FALSE;
23590;2;"13° Regimento de Cavalaria Mecanizado";"09567335000160";FALSE;
23591;6;"LIDER COMERCIAL AUTOMOTIVA LTDA - ME";"49595184000179";FALSE;
23592;2;"17 GRUPO DE ARTILHARIA DE CAMPANHA";"09605781000112";FALSE;
23593;6;"LR E M TRANSPORTADORA LTDA - ME";"07854773000184";FALSE;
23594;6;"SALENS INDUSTRIA E COMERCIO DE EQUIPAMENTOS";"10429563000153";FALSE;
23595;6;"MEGA LUX COMERCIO E SERVICOS DE MATERIAIS ELETRICOS";"04934227000165";FALSE;
23596;6;"REFORPLASTICA LTDA - ME";"38911574000194";FALSE;
23597;2;"COMANDO 11 BRIGADA DE INFANTARIA LEVE";"09559385000104";FALSE;
23598;6;"E A DE SOUZA - ME";"12989841000152";FALSE;
23599;6;"ANA MARIA DA CONCEICAO DE MENESES CAVALCANTI";"07525034000149";FALSE;
23600;6;"TIEPOLO DE AQUINO BEZERRA - ME";"08305639000197";FALSE;
23601;6;"M. L. ELIAS COMÉRCIO E SERVICOS GRÁFICOS - ME";"12509616000171";FALSE;
23602;6;"PADRAO GRAFICA EDITORA LTDA - ME";"01496690000184";FALSE;
23603;6;"CINEFLEX INDUSTRIA DE PRODUTOS VISUAIS LTDA";"10776858000104";FALSE;
23605;6;"VPC/Brasil Tecnologia Ambiental e Urbanismo Ltda";"05945216000143";FALSE;
23606;2;"Comando de Fronteira Roraima/7° Batalhão de Infantaria de Selva";"09579219000161";FALSE;
23607;6;"DANTAS TRANSPORTES E INSTALAÇÕES LTDA";"63679351000190";FALSE;
23608;6;"Pneulog Comércio de Pneumáticos Eireli - ME";"17092175000179";FALSE;
23609;6;"Celtrovic Comércio de Peças e Equipamentos";"08325368000131";FALSE;
23610;6;"BUSNELLO E QUEIROZ LTDA - ME";"08833557000115";FALSE;
23611;6;"ALPHA ELETRICA ATACADISTA LTDA - EPP";"15779491000198";FALSE;
23612;6;"JOSE CARLOS VEDAN - ME";"12438716000154";FALSE;
23613;6;"MELO DISTRIBUIDORA DE PECAS LTDA";"04618302000421";FALSE;
23614;6;"ANEFLEX FIOS E CABOS LTDA - ME";"02171371000161";FALSE;
23615;6;"LUZ E CIA COMERCIAL LTDA - ME";"16699057000160";FALSE;
23616;6;"MARCELO JACOB - ME";"11774132000197";FALSE;
23617;6;"M.I. COMERCIO DE MATERIAIS LTDA";"10670020000123";FALSE;
23618;6;"GUAXINIM COMERCIO LTDA";"08459500000106";FALSE;
23619;6;"PNEUS LONDRINENSE LTDA";"08943848000166";FALSE;
23620;6;"OSASMAC COMERCIO DE PECAS E MECANICA LTDA";"13273306000163";FALSE;
23621;2;"18º Batalhão de Infantaria Motorizado";"09543550000121";FALSE;
23622;6;"F. H. C. DE OLIVEIRA DESCARTÁVEIS - ME";"12383925000148";FALSE;
23623;6;"PROLUX ILUMINACAO LTDA - ME";"12593397000151";FALSE;
23624;6;"PROSEL COMERCIO INDUSTRIA LTDA - ME";"58833195000130";FALSE;
23625;6;"D M P RESISTENCIAS MATERIAL ELETRICO LTDA";"01913443000136";FALSE;
23626;2;"Comando de Fronteira Roraima/7°Batalhão de Infantaria de Selva";;TRUE;
23627;6;"SONAR COMERCIO E SERVIÇO IMPORTACAO & EXP";"10630019000175";FALSE;
23628;4;"FARPA COMERCIAL LTDA - ME";"13888080000105";FALSE;
23629;6;"ADDITI COSMETICOS LTDA - ME";"04178985000109";FALSE;
23630;4;"DETONI EQUIPAMENTOS DE SEGURANÇA LTDA - ME";"09549356000153";FALSE;
23631;6;"COMERCIALIZZA DISTRIBUIDORA DE PRODUTOS";"10712308000113";FALSE;
23632;6;"TIAGO ALEXANDRE BOEGERSHAUSER -  ME";"17765586000188";FALSE;
23633;6;"COMERCIAL BORA & FILHO LTDA - EPP";"04094110000110";FALSE;
23634;6;"SPAZIO COMERCIO DE MATERIAIS PARA CONSTRUÇÃO";"06085483000150";FALSE;
23635;6;"ADAIR SANTOS - ME";"10980885000196";FALSE;
23636;6;"VIDRACARIOA CAVASSIN LTDA - ME";"02162098000109";FALSE;
23637;6;"K L COMERCIO DE PRODUTOS DE INFORMATICA";"17775858000120";FALSE;
23638;6;"ESTRELA COMERCIO E SERVIÇO LTDA-EPP";"10603704000102";FALSE;
23639;6;"OLIVEIRA E SIMOES LTDA-ME";"84035914000188";FALSE;
23640;6;"ANDERSON TECNOLOGIAS DO BRASIL";"10516398000177";FALSE;
23641;6;"DETRONIX INDUSTRIA ELETRONICA LTDA";"07404500000138";FALSE;
23642;6;"CASTELAO COM MAT DE CONSTRUCAO E SERVICOS";"01268775000105";FALSE;
23643;6;"DYNAMUS COMERCIO DE ELETRO-ELETRONICOS";"11385532000100";FALSE;
23644;6;"QUANTITY BRASIL LTDA - ME";"12825850000108";FALSE;
23645;6;"LUIZANGELE FIGUEIREDO DE OLIVEIRA MENEZES";"12668168000159";FALSE;
23646;6;"GPS BRASIL COMERCIO DE IMPORTAÇÃO E EXPORTAÇÃO";"10944863000170";FALSE;
23647;6;"CRH EQUIPAMENTOS DE SEGURANÇA LTDA";"14566765000106";FALSE;
23648;6;"TATIANA BATISTA DA SILVA EPP";"10528026000160";FALSE;
23649;6;"A C FOFAN  EPP";"12506189000178";FALSE;
23650;6;"ALL WORK COMERCIAL - EIRELI - EPP";"18007154000170";FALSE;
23651;6;"PARELELAS COMERCIO DE MATERIAIS E EQUIPAMENTOS";"07555459000109";FALSE;
23653;6;"ALTASMIDIAS COMERCIAL LTDA - EPP";"09313600000184";FALSE;
23654;6;"ROMAZE INDUSTRIA E COMERCIO DE COMPUTADOR";"07315550000149";FALSE;
23655;6;"VINICIUS CHAVES DOS SANTOS - EPP";"05207424000145";FALSE;
23656;6;"LAGUNA HOUSING CONSTRUÇÕES LTDA";"13431129000104";FALSE;
23657;6;"MARBE MATERIAIS DE CONSTRUÇÃO LTDA-EPP";"11615673000172";FALSE;
23658;6;"GERALUX ELETRO ENERGIA SOLAR LTDA - EPP";"02590407000141";FALSE;
23659;6;"C.E. MACEDO E CIA LTDA - ME";"07965552000183";FALSE;
23660;6;"MATERCIC MATERIAIS DE CONSTRUCAO LTDA";"82525171000107";FALSE;
23661;6;"Elias Mucholowski - ME";"10919509000196";FALSE;
23662;6;"WMB CONSTRUCOES E REFORMAS LTDA - ME";"04628063000148";FALSE;
23663;6;"MERCEDONA DISTRIBUIDORA DE AUTOPECAS LTDA";"79793147000136";FALSE;
23664;6;"S S ENGENHARIA LTDA - ME";"21719323000100";FALSE;
23665;6;"GERATEC COMERCIO E SERVICOS LTDA - ME";"63461008000175";FALSE;
23666;2;"7º BATALHÃO DE INFANTARIA BLINDADO";"09582773000106";FALSE;
23667;6;"MBG - COMÉRCIO DE MATERIAIS DE CONSTRUÇÃO LTDA";"03810151000101";FALSE;
23668;2;"COMANDO DE OPERAÇÕES TERRESTRES";"03353358000196";FALSE;
23669;2;"11º BATALHÃO DE ENGENHARIA DE CONSTRUÇÃO";"07565863000155";FALSE;
23670;6;"PELOTAO DE OBRAS LTDA - ME";"02176627000123";FALSE;
23671;6;"ACQUAFORT COMERCIO DE MATERIAIS DE CONSTRUCA";"02264256000212";FALSE;
23672;6;"CONTABILISTA - PAPELARIA E INFORMATICA LTDA";"77765840000170";FALSE;
23673;6;"DECORINTER INDUSTRIA E COMERCIO LTDA - ME";"03884308000135";FALSE;
23674;6;"MARCIO LADEIA COSTA - ME";"04600576000140";FALSE;
23675;6;"T R CARPES & CIA LTDA - EPP";"11626657000185";FALSE;
23676;6;"TOTAL - COMERCIO DE EQUIPAMENTOS PARA ESCRIT";"16684611000136";FALSE;
23677;2;"7º Depósito de Suprimento";"09547338000132";FALSE;
23678;6;"J e F DISTRIBUIDORA DE FERRAGENS LTDA";"11666008000108";FALSE;
23679;6;"PAULO CESAR DOS SANTOS";"12795418000111";FALSE;
23680;6;"DR COMERCIO DE MATERIAIS ELETRICOS LTDA-ME";"14229359000140";FALSE;
23681;6;"SEVEN LIGHT INDUSTRIA E COMERCIO LTDA-EPP";"14441452000113";FALSE;
